{
  "schemaVersion": 1,
  "locale": "en",
  "editionId": "2026-09-28-daily",
  "baseSchemaVersion": 2,
  "factsDigest": "sha256:bdcf191f5dde3043629ebfe72e278eda812924f56bfcc2dde0ed3535e11eff60",
  "canonicalCopyDigest": "sha256:43e401762ead393c5fe31101856bca8af5249c4002036b51ee5cc39b3f5f273c",
  "localeDigest": "sha256:bb8c020a862549f95b3e0ba6c26789fdd4b22259a5fccf7111d9f7c2df2f788b",
  "archiveTitle": "Daily Brief | Seikyu: Let's Go! reveals four-player campervan trips",
  "entries": [
    {
      "entryId": "2026-09-28-daily-news-0",
      "headline": "Seikyu: Let's Go! announced with up to four-player campervan trips",
      "summary": "AUTOMATON reports that ACE Entertainment announced the PC (Steam) campervan travel game on September 28. Players take the roles of yokai visiting Seikyu Island and divide driving, navigation, photography and campsite duties. The game is planned to support up to four players and proximity voice chat.",
      "verification": "Based on the selected media excerpt in the original immutable packet; attribution and evidence limits are retained.",
      "timeNote": "The selected article was published within the original fixed window; its timestamp is expressed in Beijing time.",
      "regionLabel": "Not specified",
      "releaseTypeLabel": "News",
      "sourceLabels": [
        {
          "sourceIndex": 0,
          "label": "AUTOMATON"
        }
      ]
    },
    {
      "entryId": "2026-09-28-daily-news-1",
      "headline": "テニスの王子様: The Prince of Tennis remasters reveal DLC trailers and release dates",
      "summary": "Denfaminicogamer reports that Konami has released trailers for additional DLC for two romance-game remasters. The Ryoga Echizen DLC for Gakuensai no Ojisama is planned for October 15, while the Hikaru Zaizen DLC for Doki Doki Survival is planned for November 13. Both feature new scenarios and newly drawn illustrations.",
      "verification": "Based on the selected media excerpt in the original immutable packet; attribution and evidence limits are retained.",
      "timeNote": "The selected article was published within the original fixed window; its timestamp is expressed in Beijing time.",
      "regionLabel": "Not specified",
      "releaseTypeLabel": "News",
      "sourceLabels": [
        {
          "sourceIndex": 0,
          "label": "電ファミニコゲーマー News"
        }
      ]
    },
    {
      "entryId": "2026-09-28-daily-features-0",
      "headline": "みすずの国: Misuzu no Kuni feature examines belonging in an imagined tengu society",
      "summary": "A newly published AUTOMATON feature examines the visual novel created by Kazuki and STUDIO HOMMAGE. It discusses how an imagined tengu society portrays minority experiences and life continuing beyond unexpected circumstances. This is coverage of new critical analysis, rather than a new release announcement.",
      "verification": "Based on the selected media excerpt in the original immutable packet; attribution and evidence limits are retained.",
      "timeNote": "The selected article was published within the original fixed window; its timestamp is expressed in Beijing time.",
      "regionLabel": "Not specified",
      "releaseTypeLabel": "Feature",
      "sourceLabels": [
        {
          "sourceIndex": 0,
          "label": "AUTOMATON"
        }
      ]
    },
    {
      "entryId": "2026-09-28-daily-features-1",
      "headline": "Onimusha: Way of the Sword feature explores period-drama storytelling and combat choices",
      "summary": "A newly published AUTOMATON hands-on feature examines how Onimusha: Way of the Sword carries forward period-drama storytelling and performance, while allowing personal combat experiences through different actions. The author describes how the same encounter can be approached through different defensive and offensive techniques. These are observations by the writer, rather than an announcement of new content.",
      "verification": "Based on the selected media excerpt in the original immutable packet; attribution and evidence limits are retained.",
      "timeNote": "The selected article was published within the original fixed window; its timestamp is expressed in Beijing time.",
      "regionLabel": "Not specified",
      "releaseTypeLabel": "Feature",
      "sourceLabels": [
        {
          "sourceIndex": 0,
          "label": "AUTOMATON"
        }
      ]
    },
    {
      "entryId": "2026-09-28-daily-industry-0",
      "headline": "MindsEye developer's parent enters administration; project plans remain unclear",
      "summary": "AUTOMATON reported on September 28 that Build A Rocket Boy Ltd, the group's parent company, entered UK administration on September 23. Administrators take control of its assets and evaluate continued operation, a sale or asset disposal. Administration does not establish that liquidation is certain. Plans for MindsEye, EVERYWHERE and ARCADIA remain unclear.",
      "verification": "Based on the selected media excerpt in the original immutable packet; attribution and evidence limits are retained.",
      "timeNote": "The selected article was published within the original fixed window; its timestamp is expressed in Beijing time.",
      "regionLabel": "Not specified",
      "releaseTypeLabel": "Industry news",
      "sourceLabels": [
        {
          "sourceIndex": 0,
          "label": "AUTOMATON"
        }
      ]
    }
  ],
  "upcoming": [
    {
      "upcomingId": "2026-09-29-transport-fever-3-pc"
    },
    {
      "upcomingId": "2026-09-29-minecraft-dungeons-ii-pc"
    },
    {
      "upcomingId": "2026-09-29-minecraft-dungeons-ii-switch-2"
    },
    {
      "upcomingId": "upcoming-the-witcher-3-wild-hunt-remastered"
    },
    {
      "upcomingId": "upcoming-toem-2"
    },
    {
      "upcomingId": "2026-09-30-dynasty-warriors-3-complete-edition-remastered-pc"
    },
    {
      "upcomingId": "2026-10-01-octopath-traveler-switch-2"
    },
    {
      "upcomingId": "2026-10-01-rayman-legends-retold-switch-2"
    },
    {
      "upcomingId": "2026-10-01-ace-combat-8-pc"
    },
    {
      "upcomingId": "upcoming-end-of-abyss"
    },
    {
      "upcomingId": "upcoming-retrospace"
    },
    {
      "upcomingId": "upcoming-aion-2"
    },
    {
      "upcomingId": "upcoming-gears-of-war-e-day"
    },
    {
      "upcomingId": "2026-10-08-clive-barkers-hellraiser-revival-pc"
    },
    {
      "upcomingId": "2026-10-08-order-of-the-sinking-star-switch-2"
    },
    {
      "upcomingId": "upcoming-dragon-s-dogma-2-dark-arisen"
    }
  ],
  "sourceReport": {
    "checked": [
      "Original immutable packet and all candidate excerpts."
    ],
    "limited": [
      "Historical backfill uses the original packet and preceding verified calendar snapshot."
    ],
    "note": "A late supplement from the original September 28 fixed window."
  }
}
