{
  "schemaVersion": 1,
  "locale": "en",
  "editionId": "2026-08-21-pm",
  "baseSchemaVersion": 2,
  "factsDigest": "sha256:ef3af2517ec895f00607f04c6c58b9ffebcff1fafd4d345950d579c077442f9b",
  "canonicalCopyDigest": "sha256:e6cece569b4d683b8b973eb57ca93dac0d200950f9a4ecd053041b7e8b23b375",
  "localeDigest": "sha256:948995ef864c40747058af864678b4a91b38271ca30a7af74c43d19fbb556c4e",
  "archiveTitle": "Evening Brief | S.T.A.L.K.E.R. 2 Major Expansion and 2.0 Update Now Live",
  "entries": [
    {
      "entryId": "2026-08-21-pm-news-0",
      "headline": "Dated for November 26",
      "summary": "Toei Animation and Studio51 announced the series' first game will launch on Switch and PC, with support for Japanese and English. The title connects the 2014 film with the 2026 new film 'Heart Resonance', featuring branching choices leading to multiple endings.",
      "verification": "Press release and Steam store page both accessible; platform, language, and release date are consistent.",
      "timeNote": "Converted from Japanese press release 12:00",
      "regionLabel": "Japan / Global store",
      "sourceLabels": [
        {
          "sourceIndex": 0,
          "label": "Studio51 press release"
        },
        {
          "sourceIndex": 1,
          "label": "Steam store"
        }
      ],
      "mediaAlts": [
        {
          "assetKey": "editorial:2026-08-21-pm-news-0:https%3A%2F%2Fstore.steampowered.com%2Fapp%2F4607420%2F_The_Stellar_Angel%2F:media%2Fbriefs%2F2026%2F08%2F2026-08-21-pm%2F2026-08-21-pm-news-0-editorial.jpg",
          "alt": "Expelled from Paradise: The Stellar Angel official announcement image for November 26 release"
        }
      ]
    },
    {
      "entryId": "2026-08-21-pm-releases-1",
      "headline": "Steam demo now available",
      "summary": "The demo begins with the prologue where an editor is trapped inside a manuscript, allowing exploration between a 2D ink-wash world and a 3D mansion; completing the main portion unlocks an extra boss challenge.",
      "verification": "Steam directly offers the demo download; 4Gamer used to supplement opening time.",
      "timeNote": "Converted from Japanese media release time",
      "regionLabel": "Global",
      "releaseTypeLabel": "Free demo",
      "sourceLabels": [
        {
          "sourceIndex": 0,
          "label": "Steam store"
        },
        {
          "sourceIndex": 1,
          "label": "4Gamer"
        }
      ],
      "mediaAlts": [
        {
          "assetKey": "editorial:2026-08-21-pm-releases-1:https%3A%2F%2Fstore.steampowered.com%2Fapp%2F4018380%2FChronoscript_The_Endless_End%2F:media%2Fbriefs%2F2026%2F08%2F2026-08-21-pm%2F2026-08-21-pm-releases-1-editorial.jpg",
          "alt": "Chronoscript: The Endless End official image for Steam demo availability"
        }
      ]
    },
    {
      "entryId": "2026-08-21-pm-releases-0",
      "headline": "Steam Early Access now live",
      "summary": "MELTCLOCK's roguelite factory sim is now purchasable. The launch version offers three sponsor company combinations and dozens of hours of content; the team plans at least six months of Early Access.",
      "verification": "Steam shows August 20, Phoenixx Japan announcement records August 21; regional differences retained.",
      "timeNote": "Converted from Japanese media release time",
      "regionLabel": "Global / Store region date differs",
      "releaseTypeLabel": "Early Access",
      "sourceLabels": [
        {
          "sourceIndex": 0,
          "label": "Steam store"
        },
        {
          "sourceIndex": 1,
          "label": "4Gamer"
        }
      ],
      "mediaAlts": [
        {
          "assetKey": "editorial:2026-08-21-pm-releases-0:https%3A%2F%2Fstore.steampowered.com%2Fapp%2F3971650%2FLazy_Witchs_Factory%2F:media%2Fbriefs%2F2026%2F08%2F2026-08-21-pm%2F2026-08-21-pm-releases-0-editorial.jpg",
          "alt": "Lazy Witch’s Factory official image for Steam Early Access launch"
        }
      ]
    },
    {
      "entryId": "2026-08-21-pm-releases-2",
      "headline": "Major expansion and 2.0 update now live",
      "summary": "Official Steam news confirms the major expansion and free 2.0 update are released. The expansion adds two regions and dozens of hours of content; 2.0 migrates the engine to UE 5.5.4 and adjusts lighting, AI, and ecology.",
      "verification": "Release fact confirmed; official site, Steam, and Japan announcement lack unified timezone notation.",
      "timeNote": "Global unlock boundary pending verification",
      "regionLabel": "Global unlock boundary pending verification",
      "releaseTypeLabel": "Major DLC + free update",
      "sourceLabels": [
        {
          "sourceIndex": 0,
          "label": "Steam official news"
        },
        {
          "sourceIndex": 1,
          "label": "4Gamer"
        }
      ],
      "mediaAlts": [
        {
          "assetKey": "editorial:2026-08-21-pm-releases-2:https%3A%2F%2Fstore.steampowered.com%2Fnews%2Fapp%2F1643320%2Fview%2F677381523352060037:media%2Fbriefs%2F2026%2F08%2F2026-08-21-pm%2F2026-08-21-pm-releases-2-editorial.jpg",
          "alt": "S.T.A.L.K.E.R. 2: Heart of Chornobyl official image for major expansion and 2.0 update release"
        }
      ]
    },
    {
      "entryId": "2026-08-21-pm-news-1",
      "headline": "Confirmed for Tokyo Game Show 2026",
      "summary": "NC confirmed that the fantasy RPG developed by Dynamis One will have its own booth at Makuhari Messe from September 17 to 21; operational details and schedule will be announced on a later dedicated page.",
      "verification": "Official account original post accessible; two media outlets used to supplement booth and time information.",
      "timeNote": "Converted from Korean media release time",
      "regionLabel": "Japan",
      "sourceLabels": [
        {
          "sourceIndex": 0,
          "label": "Official X"
        },
        {
          "sourceIndex": 1,
          "label": "GameMeca"
        },
        {
          "sourceIndex": 2,
          "label": "4Gamer"
        }
      ]
    },
    {
      "entryId": "2026-08-21-pm-observations-0",
      "headline": "Confirmed for Netflix premiere on October 20",
      "summary": "This round verified CD PROJEKT RED's press release and Netflix's official trailer, confirming the second season is a standalone 10-episode story. The original announcement predates this window, so it is included as a delayed catch-up.",
      "verification": "Primary pages verified; this is a catch-up item, not counted as new news in the current window.",
      "timeNote": "Official pages only list the date",
      "regionLabel": "Global",
      "sourceLabels": [
        {
          "sourceIndex": 0,
          "label": "CD PROJEKT RED press release"
        },
        {
          "sourceIndex": 1,
          "label": "Netflix official trailer"
        }
      ],
      "mediaAlts": [
        {
          "assetKey": "editorial:2026-08-21-pm-observations-0:https%3A%2F%2Fpress.cdprojektred.com%2Fen%2Fnews%2F1837%2Fcyberpunk-edgerunners-2-premiere-date-announced-alongside-new-trailer:media%2Fbriefs%2F2026%2F08%2F2026-08-21-pm%2F2026-08-21-pm-observations-0-editorial.jpg",
          "alt": "Cyberpunk: Edgerunners 2 official image for Netflix premiere date announcement"
        }
      ]
    }
  ],
  "upcoming": [
    {
      "upcomingId": "upcoming-once-human-console",
      "regionLabel": "Global / Regional dates differ",
      "releaseTypeLabel": "Console port",
      "sourceLabel": "NetEase Investor Relations",
      "coverAlt": "Once Human official store cover"
    },
    {
      "upcomingId": "upcoming-apidya",
      "regionLabel": "Global / Store timezone differs",
      "releaseTypeLabel": "Remastered full release",
      "sourceLabel": "ININ Games",
      "coverAlt": "Apidya’ Special official store cover"
    },
    {
      "upcomingId": "upcoming-aliens-fireteam-2",
      "regionLabel": "Global",
      "releaseTypeLabel": "Full release",
      "sourceLabel": "Steam",
      "coverAlt": "Aliens: Fireteam Elite 2 official store cover"
    },
    {
      "upcomingId": "upcoming-lous-lagoon",
      "regionLabel": "Global",
      "releaseTypeLabel": "Full release",
      "sourceLabel": "PlayStation Blog",
      "coverAlt": "Lou’s Lagoon official store cover"
    },
    {
      "upcomingId": "upcoming-mgs-master-2",
      "regionLabel": "Global / Pre-order times differ by region",
      "releaseTypeLabel": "Collection full release",
      "sourceLabel": "KONAMI announcement",
      "coverAlt": "METAL GEAR SOLID: MASTER COLLECTION Vol.2 official store cover"
    }
  ]
}
