{
  "schemaVersion": 1,
  "locale": "en",
  "editionId": "2026-08-30-am",
  "baseSchemaVersion": 2,
  "factsDigest": "sha256:54ce2ddca9ff968e03a0b2d1bb25ddd60f89f5903460d1deb96ac94c128b988b",
  "canonicalCopyDigest": "sha256:daf2b10ef93f7093448f3a9c6f10282d9f2aadde03f46a615f98eceb89858825",
  "localeDigest": "sha256:2b870b89a7df5a4d8b11569f31a99b8ef2599eea6d0fa2785284770bab489537",
  "archiveTitle": "Morning Brief | The Witcher 3 Expansion Reveals Letten and Story Details",
  "entries": [
    {
      "entryId": "2026-08-30-am-features-0",
      "headline": "The Witcher 3 Expansion “Songs of the Past” Reveals Letten and Story-Focused Open-World Details",
      "summary": "Xbox Wire played roughly 45 minutes of The Witcher 3: Wild Hunt expansion “Songs of the Past.” Developed by Fool’s Theory with CD Projekt Red, the expansion is set in Dandelion’s homeland of Letten, where Geralt investigates the bard’s family past and a mystery tied to the “Garden of Thorns.” Fool’s Theory describes Letten as a full open world and has upgraded NPC systems to make the region feel more lived-in.",
      "verification": "The opened Xbox Wire primary preview directly supports the hands-on duration, development partners, Letten setting, quest clues, open-world scope, and NPC-system description. The Simplified Chinese game title in Canonical was normalized separately from the official Steam store.",
      "timeNote": "Xbox Wire published the preview at 2026-08-29T12:19:42Z, or 20:19 Beijing time on August 29, inside the fixed window of August 29 17:00 exclusive through August 30 10:10 inclusive.",
      "regionLabel": "Global",
      "releaseTypeLabel": "Expansion preview / developer showcase",
      "sourceLabels": [
        {
          "sourceIndex": 0,
          "label": "Xbox Wire"
        }
      ]
    }
  ],
  "upcoming": [
    {
      "upcomingId": "upcoming-serious-sam-shatterverse"
    },
    {
      "upcomingId": "upcoming-wheelmates"
    },
    {
      "upcomingId": "upcoming-arknights-endfield-dreamscape"
    },
    {
      "upcomingId": "upcoming-moonlighter-2-1-0"
    },
    {
      "upcomingId": "upcoming-withering-realms"
    },
    {
      "upcomingId": "upcoming-blood-of-dawnwalker"
    },
    {
      "upcomingId": "upcoming-bioeden"
    },
    {
      "upcomingId": "upcoming-marsupilami-2"
    },
    {
      "upcomingId": "upcoming-orbitals"
    },
    {
      "upcomingId": "upcoming-wo-long-complete-switch2"
    },
    {
      "upcomingId": "upcoming-avatar-legends-fighting-game"
    },
    {
      "upcomingId": "upcoming-nba-2k27"
    },
    {
      "upcomingId": "upcoming-isle-of-reveries"
    },
    {
      "upcomingId": "upcoming-my-hero-academia-alls-justice-switch2"
    },
    {
      "upcomingId": "upcoming-onimusha-way-of-the-sword"
    },
    {
      "upcomingId": "upcoming-order-automatica"
    },
    {
      "upcomingId": "upcoming-phantom-of-inferno"
    },
    {
      "upcomingId": "upcoming-mythmon-mythic-monsters"
    },
    {
      "upcomingId": "upcoming-culdcept-first-saturn-tribute-west"
    },
    {
      "upcomingId": "upcoming-halloween-the-game"
    },
    {
      "upcomingId": "upcoming-honeycomb-the-world-beyond"
    },
    {
      "upcomingId": "upcoming-mewgenics-console"
    },
    {
      "upcomingId": "upcoming-surviving-mars-feeding-future"
    },
    {
      "upcomingId": "upcoming-valheim-1-0"
    },
    {
      "upcomingId": "upcoming-zenless-zone-zero-3-2"
    },
    {
      "upcomingId": "upcoming-hazard-pay"
    },
    {
      "upcomingId": "upcoming-screenbound"
    },
    {
      "upcomingId": "upcoming-alighieri-circle"
    }
  ]
}
